
 Primary working directories    : /home/chalabaj/SNAFU/ABINITIO/scratch
 Secondary working directories  : /home/chalabaj/SNAFU/ABINITIO/scratch
 Wavefunction directory         : /home/chalabaj/SNAFU/ABINITIO/scratch/
 Main file repository           : /home/chalabaj/SNAFU/ABINITIO/

 SHA1      : 41aa48e1468dac041f2eaabdf410f3ce2ee7f8bf
 NAME      : 2015.1.0
 ARCHNAME  : linux/x86_64
 FC        : /opt/intel/composer_xe_2015.1.133/bin/intel64/ifort
 BLASLIB   : -Wl,-_start-group /opt/intel/mkl/lib/intel64/libmkl_intel_ilp64.a /opt/intel/mkl/lib/intel64/libmkl_intel_thread.a /opt/intel/mkl/lib/intel64/libmkl_core.a -Wl,-_end-group
 id        : vscht

 Nodes      nprocs
 403-as67-01    1

 Using customized tuning parameters: mindgm=1; mindgv=20; mindgc=4; mindgr=1; noblas=0; minvec=7
 default implementation of scratch files=df  

 memory, 1000,m;
 file, 2, input.wfu,unknown
 PUNCH, input.pun,new
 gprint, orbital,civector
 symmetry,nosym
 Angstrom
 
 geometry=../abinit_geom.xyz
 Including file /home/chalabaj/SNAFU/ABINITIO/../abinit_geom.xyz
 
 basis=6-31g**
 
                                                                  !-for simple CASSCF, you don't need to modify anything below this
 
                                                        !-we need to get rid of the SAMC records in file 2 (input.wfu,restart file)
                                                               !-otherwise, the forces and NACME are wrong for the following reason
                                                         !-cpmscf will not rewrite itself it but ather write into following records
                                                   !-but the subsequent call to forces would read from old records -&gt; wrong numbers
                                                                              !-we use file 2 for forces and NACME due to df-casscf
 
 data,truncate,2,5101
 
 if (lastorb.ne.MCSCF)then
    {hf;wf,9,0,1}
 endif
 
 multi;
 occ,6;
 closed,2;
 WF,9,0,1;
 state,3;
 maxiter,40;
 ORBITAL,2140.2;
 NOEXTRA;
 
 cpmcscf,grad,3.1,ACCU=1d-9,save=5101.2;
 forces;samc,5101.2;
 
 if (status.lt.0) then
    text, MCSCF failed to converge.
    text, Attempting uncoupled iterations.
    text, Enlarging PSPACE.
    {multi;
    occ,6;
    closed,2;
    WF,9,0,1;
                                                    ! Info about pspace: https://www.molpro.net/info/2015.1/doc/manual/node244.html
                                                                                 ! uncomment in case of convergence difficulties...
    pspace, 2;
    state,3;
    maxiter,40;
    {iterations
    do,uncouple,1,to,5}
    }
 endif

 Variables initialized (889), CPU time= 0.00 sec
 Commands  initialized (702), CPU time= 0.01 sec, 572 directives.
 Default parameters read. Elapsed time= 0.05 sec

 Checking input...
 Passed
1


                                         ***  PROGRAM SYSTEM MOLPRO  ***
                                       Copyright, TTI GmbH Stuttgart, 2015
                                    Version 2015.1 linked Nov 26 2015 20:23:21


 **********************************************************************************************************************************
 LABEL *                                                                                 
  64 bit serial version                                                                  DATE: 23-Oct-18          TIME: 21:08:24  
 **********************************************************************************************************************************

 SHA1:             41aa48e1468dac041f2eaabdf410f3ce2ee7f8bf
 **********************************************************************************************************************************

 Variable memory set to 1000000000 words,  buffer space   230000 words



 Permanent file  2  input.wfu        assigned.  Implementation=df    Size=  1.66 MB
 

 PROGRAM * RESTART 


 Reading variables from file 2

 _NUMVAR         =    896.00000000
 _DKROLL_DONE    =      0.00000000
 _FOCKDONE       =      1.00000000
 _GRADONE        =      1.00000000
 _INTDONE        =      1.00000000
 _DIRECT         =      0.00000000
 _DKHO           =     -1.00000000
 _BASIS          =    6-31G**
 _ZUNIT          =    ANG
 _NELEC          =      9.00000000
 _PROGRAM        =    FORCES
 _CPUSTEP        =      0.03000000
 _SYSSTEP        =      0.00000000
 _WALLSTEP       =      0.02000000
 _BASINP         =    610.00000000
 _CPUTOT         =      0.53000000
 _DFTEXFAC       =      1.00000000
 _DMX(1:3)       =      0.89727318     0.74756077     1.10825360
 _DMY(1:3)       =      0.00000000    -0.00000000    -0.00000000
 _DMZ(1:3)       =      0.73219296     0.59966647     0.87208872
 _DMX_SCF        =      0.82287042
 _DMY_SCF        =     -0.00000000
 _DMZ_SCF        =      0.64289675
 _EHOMO          =     -1.12124037
 _ELUMO          =     -0.12639805
 _EIGS(1:24)     =    -21.12147512    -1.83277762    -1.19744363    -1.07141239    -1.12124037    -0.12639805
                       -0.03821331     0.59344802     0.64943819     0.64956023     0.74670738     0.86103426
                        1.13263371     1.30422684     1.34702425     1.41583124     2.08125730     2.15015639
                        2.33505470     2.49870392     2.52393342     2.92537502     3.27844797     3.46460561
 _ENERGY(1:3)    =    -75.63578139   -75.54629139   -75.38775603
 _ENERGY_METHOD  =    MULTI
 _ENERGY_BASIS   =    6-31G**
 _GEOMETRY_METHOD=     
 _GEOMETRY_BASIS =     
 _ENUC           =      9.10255654
 _EPS1(1:6)      =    -21.09946198    -1.81781087    -1.01450852    -0.89485278    -1.05046209     0.42228707
 _GRADENERG      =    -75.38775603
 _GRADEXFAC      =   9999.00000000
 _GRADMETHOD     =      5.00000000
 _VIRIAL         =     -0.39522684
 _ITERATIONS     =      4.00000000
 _LASTNELEC      =      5.00000000
 _LASTSPIN       =      1.00000000
 _LASTSYM        =      1.00000000
 _ORBITAL        =   2140.20000000
 _SEIG_MIN       =      0.04384952
 _SEWPROP        =      1.00000000
 _STATUS         =      1.00000000
 _SYSTOT         =      0.59000000
 _WALLTOT        =      1.14000000
 _LASTORB        =    MCSCF
 _PGROUP         =    C1  
 _TIME           =    11:01:44
 _DMX_CC(1:3)    =     -0.48465441    -0.48465441    -0.48465441
 _DMY_CC(1:3)    =      0.00000000     0.00000000     0.00000000
 _DMZ_CC(1:3)    =     -0.50537117    -0.50537117    -0.50537117
 _DMX_NUC(1:3)   =      1.76781594     1.76781594     1.76781594
 _DMY_NUC(1:3)   =      0.00000000     0.00000000     0.00000000
 _DMZ_NUC(1:3)   =      1.38039418     1.38039418     1.38039418
 _TRDMX(1:3)     =      0.00000000    -0.00000000    -0.06877280
 _TRDMY(1:3)     =     -0.16635210    -0.00768741     0.00000000
 _TRDMZ(1:3)     =      0.00000000    -0.00000000     0.07188818

 Geometry written to block  1 of record 700


 **********************************************************************************************************************************
 DATASETS  * FILE   NREC   LENGTH (MB)   RECORD NAMES
              2       8        1.74       500      700      610     1000      520     2100     2140     5101   
                                          VAR     GEOM    BASINP    BASIS   MCVARS     RHF     MCSCF   CPSAMC    

 PROGRAMS   *        TOTAL   RESTART
 CPU TIMES  *         0.13      0.01
 REAL TIME  *         0.12 SEC
 DISK USED  *         0.03 MB      
 **********************************************************************************************************************************

 PUNCHFILE INPUT.PUN OPENED

 ZSYMEL=NOSYM
 ZUNIT=ANG
 

Geometry recognized as XYZ

 SETTING BASIS          =    6-31G**

 

 TRUNCATING FILE 1 AFTER   1 RECORDS

 TRUNCATING FILE 2 BEFORE RECORD  5101


 **********************************************************************************************************************************
 DATASETS  * FILE   NREC   LENGTH (MB)   RECORD NAMES
              2       7        1.73       500      700      610     1000      520     2100     2140   
                                          VAR     GEOM    BASINP    BASIS   MCVARS     RHF     MCSCF   

 PROGRAMS   *        TOTAL      DATA   RESTART
 CPU TIMES  *         0.13      0.00      0.01
 REAL TIME  *         0.13 SEC
 DISK USED  *         2.89 MB      
 **********************************************************************************************************************************


 Recomputing integrals since basis changed


 Using spherical harmonics

 Library entry O      S 6-31G                selected for orbital group  1
 Library entry O      P 6-31G                selected for orbital group  1
 Library entry O      D 6-31G*               selected for orbital group  1
 Library entry H      S 6-31G                selected for orbital group  2
 Library entry H      P 6-31G**              selected for orbital group  2

1PROGRAM * SEWARD (Integral evaluation for generally contracted gaussian basis sets)     Author: Roland Lindh, 1990

 Geometry written to block  1 of record 700


 Point group  C1  



 ATOMIC COORDINATES

 NR  ATOM    CHARGE       X              Y              Z

   1  O       8.00   -0.002010354    0.000000000   -0.001396464
   2  H       1.00    0.007359252    0.000000000    1.832988746
   3  H       1.00    1.783001915    0.000000000   -0.436970377

 Bond lengths in Bohr (Angstrom)

 1-2  1.834409138  1-3  1.837387666
     ( 0.970727511)     ( 0.972303680)

 Bond angles

  2-1-3  103.42052280

 NUCLEAR CHARGE:                   10
 NUMBER OF PRIMITIVE AOS:          42
 NUMBER OF SYMMETRY AOS:           41
 NUMBER OF CONTRACTIONS:           24   (  24A   )
 NUMBER OF CORE ORBITALS:           1   (   1A   )
 NUMBER OF VALENCE ORBITALS:        6   (   6A   )


 NUCLEAR REPULSION ENERGY    9.06207253

 EXTRA SYMMETRY OF AOS IN SYMMETRY 1:   1 1 1 1 2 1 1 2 1 1   2 1 1 2 1 1 1 2 1 1   1 1 2 1

 Eigenvalues of metric

         1 0.442E-01 0.696E-01 0.163E+00 0.218E+00 0.347E+00 0.379E+00 0.387E+00 0.421E+00


 Contracted 2-electron integrals neglected if value below      1.0D-11
 AO integral compression algorithm  1   Integral accuracy      1.0D-11

     0.262 MB (compressed) written to integral file ( 74.7%)


 NUMBER OF SORTED TWO-ELECTRON INTEGRALS:      45150.     BUFFER LENGTH:  32768
 NUMBER OF SEGMENTS:   1  SEGMENT LENGTH:      45150      RECORD LENGTH: 524288

 Memory used in sort:       0.60 MW

 SORT1 READ       59680. AND WROTE       22136. INTEGRALS IN      1 RECORDS. CPU TIME:     0.00 SEC, REAL TIME:     0.00 SEC
 SORT2 READ       22136. AND WROTE       45150. INTEGRALS IN      1 RECORDS. CPU TIME:     0.00 SEC, REAL TIME:     0.01 SEC

 FILE SIZES:   FILE 1:    16.7 MBYTE,  FILE 4:     4.2 MBYTE,   TOTAL:     20.9 MBYTE

 OPERATOR DM      FOR CENTER  0  COORDINATES:    0.000000    0.000000    0.000000


 **********************************************************************************************************************************
 DATASETS  * FILE   NREC   LENGTH (MB)   RECORD NAMES
              1      19       16.57       500      700      610      900      950      970     1000      129      960     1100   
                                          VAR     GEOM    BASINP   SYMINP    ZMAT    AOBASIS   BASIS     P2S    ABASIS      S 
                                         1400     1410     1200     1210     1080     1600     1650     1300     1700   
                                           T        V       H0       H01     AOSYM     SMH    MOLCAS    ERIS     OPER   

              2       7        1.73       500      700      610     1000      520     2100     2140   
                                          VAR     GEOM    BASINP    BASIS   MCVARS     RHF     MCSCF   

 PROGRAMS   *        TOTAL       INT      DATA   RESTART
 CPU TIMES  *         0.42      0.29      0.00      0.01
 REAL TIME  *         1.07 SEC
 DISK USED  *        22.69 MB      
 **********************************************************************************************************************************

1PROGRAM * MULTI (Direct Multiconfiguration SCF)       Authors: P.J. Knowles, H.-J. Werner (1984)     S.T. Elbert (1988)


 Number of closed-shell orbitals:   2 (   2 )
 Number of active  orbitals:        4 (   4 )
 Number of external orbitals:      18 (  18 )

 State symmetry 1

 Number of electrons:     5    Spin symmetry=Doublet   Space symmetry=1
 Number of states:        3
 Number of CSFs:         20   (24 determinants, 24 intermediate states)

 Iteration controls:
             1  2  3  4  5  6  7  8  9 10 11 12 13 14 15 16 17 18 19 20 21 22 23 24 25 26 27 28 29 30 31 32 33 34 35 36 37 38 39
 DIAGCI      T  T  T  T  T  T  T  T  T  T  T  T  T  T  T  T  T  T  T  T  T  T  T  T  T  T  T  T  T  T  T  T  T  T  T  T  T  T  T
 WERNER      T  T  T  T  T  T  T  T  T  T  T  T  T  T  T  T  T  T  T  T  T  T  T  T  T  T  T  T  T  T  T  T  T  T  T  T  T  T  T
 INTERNAL    F  T  T  T  T  T  T  T  T  T  T  T  T  T  T  T  T  T  T  T  T  T  T  T  T  T  T  T  T  T  T  T  T  T  T  T  T  T  T

 Molecular orbitals read from record     2140.2  Type=MCSCF/NATURAL (state averaged)

 Wavefunction dump at record             2140.2

 Convergence thresholds  0.10E-05 (gradient)  0.10E-07 (energy)  0.10E-02 (step length)

 Weight factors for state symmetry  1:    0.33333   0.33333   0.33333

 Number of orbital rotations:      116   (     8 Core/Active     36 Core/Virtual   0 Active/Active     72 Active/Virtual)
 Total number of variables:        188


 ITER. MIC  NCI  NEG     ENERGY(VAR)     ENERGY(PROJ)   ENERGY CHANGE     GRAD(0)  GRAD(ORB)   GRAD(CI)     STEP       TIME

   1   20    7    0     -75.52404587     -75.52405847   -0.00001260    0.00678832 0.00000167 0.00000000  0.47D-02      0.01
   2   23   13    0     -75.52405847     -75.52405847   -0.00000000    0.00000277 0.00000007 0.00000000  0.94D-04      0.02
   3   23   10    0     -75.52405847     -75.52405847   -0.00000000    0.00000006 0.00000001 0.00000000  0.34D-05      0.03
   4   23   10    0     -75.52405847     -75.52405847    0.00000000    0.00000001 0.00000000 0.00000000  0.71D-06      0.04

 ** WVFN ****  CONVERGENCE REACHED, FINAL GRADIENT:  0.28D-08

 Solving MCSCF z-vector equations for state  3.1, requested accuracy=      0.10D-08
 Convergence reached in  20 iterations ( 20 expansion vectors), accuracy=  0.32D-09

 SA-Gradient information saved on record      5101.2



 Results for state 1.1
 =====================

 !MCSCF STATE 1.1 Energy              -75.636041394541
 Nuclear energy                         9.06207253
 Kinetic energy                        75.44554339
 One electron energy                 -117.68962618
 Two electron energy                   32.99151225
 Virial ratio                           2.00252497

 !MCSCF STATE 1.1 Dipole moment         0.90298511    -0.00000000     0.73660363
 Dipole moment /Debye                   2.29500889    -0.00000000     1.87213705

 Results for state 2.1
 =====================

 !MCSCF STATE 2.1 Energy              -75.546062639380
 Nuclear energy                         9.06207253
 Kinetic energy                        75.55917263
 One electron energy                 -117.86300722
 Two electron energy                   33.25487205
 Virial ratio                           1.99982649

 !MCSCF STATE 2.1 Dipole moment         0.75565614     0.00000000     0.60637815
 Dipole moment /Debye                   1.92056053     0.00000000     1.54115857

 Results for state 3.1
 =====================

 !MCSCF STATE 3.1 Energy              -75.390071382138
 Nuclear energy                         9.06207253
 Kinetic energy                        75.81008882
 One electron energy                 -117.87812595
 Two electron energy                   33.42598203
 Virial ratio                           1.99445961

 !MCSCF STATE 3.1 Dipole moment         1.11536252     0.00000000     0.87650554
 Dipole moment /Debye                   2.83478307     0.00000000     2.22770895

 State-averaged charge density matrix saved on record  2140.2 (density set 1)

 !MCSCF expec         <1.1|DMX|1.1>     0.902985106491 au =     2.295008886955 Debye
 !MCSCF expec         <2.1|DMX|2.1>     0.755656138484 au =     1.920560528449 Debye
 !MCSCF trans         <3.1|DMX|2.1>    -0.070498881061 au =    -0.179178546127 Debye
 !MCSCF expec         <3.1|DMX|3.1>     1.115362517090 au =     2.834783066184 Debye

 !MCSCF trans         <2.1|DMY|1.1>    -0.165658171327 au =    -0.421033495081 Debye
 !MCSCF trans         <3.1|DMY|1.1>    -0.008084963768 au =    -0.020548582213 Debye

 !MCSCF expec         <1.1|DMZ|1.1>     0.736603628136 au =     1.872137049197 Debye
 !MCSCF expec         <2.1|DMZ|2.1>     0.606378147936 au =     1.541158573232 Debye
 !MCSCF trans         <3.1|DMZ|2.1>     0.073380161893 au =     0.186501551864 Debye
 !MCSCF expec         <3.1|DMZ|3.1>     0.876505537976 au =     2.227708945210 Debye


 NATURAL ORBITALS (state averaged)
 =================================

   Orb     Occ        Energy       Coefficients

                                   1 1s      1 1s      1 1s      1 2px     1 2py     1 2pz     1 2px     1 2py     1 2pz     1 3d0  
                                   1 3d2-    1 3d1+    1 3d2+    1 3d1-    2 1s      2 1s      2 2px     2 2py     2 2pz     3 1s   
                                   3 1s      3 2px     3 2py     3 2pz  

   1.1  2.00000   -21.099048     0.995740  0.021859 -0.006117  0.001401 -0.000000  0.000995 -0.000746 -0.000000 -0.000602  0.000208
                                -0.000000 -0.000165  0.000268  0.000000 -0.000436  0.001240  0.000070  0.000000  0.001044 -0.000409
                                 0.001243  0.001032 -0.000000 -0.000187

   2.1  2.00000    -1.815000    -0.215181  0.504355  0.433046  0.075482 -0.000000  0.079988  0.035979  0.000000  0.039506  0.003385
                                 0.000000  0.002553  0.004040 -0.000000  0.148186 -0.008267  0.002372 -0.000000 -0.030097  0.130741
                                -0.012983 -0.026817  0.000000  0.009628

   3.1  1.66609    -1.012856     0.063745 -0.170685 -0.201826  0.186235  0.000000  0.568617  0.119943  0.000000  0.307871  0.017660
                                 0.000000  0.024250  0.004529  0.000000  0.244486  0.062642  0.006895  0.000000 -0.026619 -0.025664
                                 0.008018  0.008349  0.000000  0.015345

   4.1  1.66597    -0.893753    -0.000000  0.000000  0.000000 -0.000000  0.699098 -0.000000 -0.000000  0.433003 -0.000000 -0.000000
                                 0.022567 -0.000000 -0.000000  0.017397 -0.000000 -0.000000 -0.000000  0.021121  0.000000  0.000000
                                -0.000000 -0.000000  0.020837 -0.000000

   5.1  1.65650    -1.047464    -0.038079  0.104984  0.133494 -0.566288  0.000000  0.138310 -0.299733  0.000000  0.052807  0.019860
                                 0.000000 -0.007611 -0.022440 -0.000000  0.103167  0.016705 -0.015372  0.000000 -0.011978 -0.282207
                                -0.072591  0.027807  0.000000 -0.009011

   6.1  0.01144     0.414586     0.027331 -0.022405 -0.279211 -0.768378  0.000000  0.314554  0.173902 -0.000000  0.034244 -0.090063
                                -0.000000 -0.035569  0.143761  0.000000 -0.154439 -0.085429  0.009549 -0.000000  0.010721  0.646153
                                 0.205895 -0.038518 -0.000000  0.019624

 Total charge:   1.000000000000
 

 Natural orbital dump (state averaged) at molpro section  2140.2    (Orbital set 2)


 CI vector
 =========

 2a20      0.9960020  -0.0000000  -0.0000000
 22a0      0.0000000  -0.5499851   0.8337722
 a220      0.0000000   0.8314670   0.5477567
 2a02     -0.0844990   0.0000000   0.0000000
 a202     -0.0000000  -0.0714699  -0.0470560

 TOTAL ENERGIES                       -75.63604139   -75.54606264   -75.39007138



 **********************************************************************************************************************************
 DATASETS  * FILE   NREC   LENGTH (MB)   RECORD NAMES
              1      20       16.73       500      700      610      900      950      970     1000      129      960     1100   
                                          VAR     GEOM    BASINP   SYMINP    ZMAT    AOBASIS   BASIS     P2S    ABASIS      S 
                                         1400     1410     1200     1210     1080     1600     1650     1300     1700     1380   
                                           T        V       H0       H01     AOSYM     SMH    MOLCAS    ERIS     OPER     JKOP   

              2       8        1.74       500      700      610     1000      520     2100     2140     5101   
                                          VAR     GEOM    BASINP    BASIS   MCVARS     RHF     MCSCF   CPSAMC    

 PROGRAMS   *        TOTAL     MULTI       INT      DATA   RESTART
 CPU TIMES  *         0.46      0.04      0.29      0.00      0.01
 REAL TIME  *         1.12 SEC
 DISK USED  *        22.69 MB      
 **********************************************************************************************************************************

1PROGRAM * FORCE (Gradient of the energy)

 SA-MCSCF information from    5101.2
 Orbitals from record         2140.2

 Number of closed-shell orbitals:  2 (  2 )
 Number of active orbitals:        4 (  4 )
 Number of occupied orbitals:      6 (  6 )

 Number of electrons=  9     Doublet     Space symmetry=1      Wavefunction type: SA-MCSCF


 End of calculation of the energy gradient  ,IREST=   0


 SA-MC GRADIENT FOR STATE 3.1

 Atom          dE/dx               dE/dy               dE/dz

   1         0.179557509         0.000000000         0.123511743
   2        -0.057859036         0.000000000        -0.094243567
   3        -0.121698473        -0.000000000        -0.029268176

 Nuclear force contribution to virial =        -0.377905936


 **********************************************************************************************************************************
 DATASETS  * FILE   NREC   LENGTH (MB)   RECORD NAMES
              1      20       16.73       500      700      610      900      950      970     1000      129      960     1100   
                                          VAR     GEOM    BASINP   SYMINP    ZMAT    AOBASIS   BASIS     P2S    ABASIS      S 
                                         1400     1410     1200     1210     1080     1600     1650     1300     1700     1380   
                                           T        V       H0       H01     AOSYM     SMH    MOLCAS    ERIS     OPER     JKOP   

              2       8        1.74       500      700      610     1000      520     2100     2140     5101   
                                          VAR     GEOM    BASINP    BASIS   MCVARS     RHF     MCSCF   CPSAMC    

 PROGRAMS   *        TOTAL    FORCES     MULTI       INT      DATA   RESTART
 CPU TIMES  *         0.48      0.02      0.04      0.29      0.00      0.01
 REAL TIME  *         1.14 SEC
 DISK USED  *        22.69 MB      
 **********************************************************************************************************************************

 MULTI/6-31G** energy=    -75.390071382138

        MULTI   
    -75.39007138
 **********************************************************************************************************************************
 Variable memory released
