
 Primary working directories    : /home/chalabaj/SNAFU-DEV/ABINITIO/scratch
 Secondary working directories  : /home/chalabaj/SNAFU-DEV/ABINITIO/scratch
 Wavefunction directory         : /home/chalabaj/SNAFU-DEV/ABINITIO/scratch/
 Main file repository           : /home/chalabaj/SNAFU-DEV/ABINITIO/

 SHA1      : ff24c56d2a0a94969fcbec04a36b96e977f08fcb
 NAME      : 2015.1.28
 ARCHNAME  : linux/x86_64
 FC        : /opt/intel/composer_xe_2015.1.133/bin/intel64/ifort
 BLASLIB   : -Wl,-_start-group /opt/intel/mkl/lib/intel64/libmkl_intel_ilp64.a /opt/intel/mkl/lib/intel64/libmkl_intel_thread.a /opt/intel/mkl/lib/intel64/libmkl_core.a -Wl,-_end-group
 id        : vscht

 Nodes      nprocs
 403-a324-01    1

 Using customized tuning parameters: mindgm=1; mindgv=20; mindgc=4; mindgr=1; noblas=0; minvec=7
 default implementation of scratch files=df  

 memory, 1000,m;
 file, 2, input.wfu,unknown
 PUNCH, input.pun,new
 gprint, orbital,civector
 symmetry,nosym
 Angstrom
 
 geometry=../abinit_geom.xyz
 Including file /home/chalabaj/SNAFU-DEV/ABINITIO/../abinit_geom.xyz
 
 basis=6-31g
 
                                                                  !-for simple CASSCF, you don't need to modify anything below this
 
                                                        !-we need to get rid of the SAMC records in file 2 (input.wfu,restart file)
                                                               !-otherwise, the forces and NACME are wrong for the following reason
                                                         !-cpmscf will not rewrite itself it but ather write into following records
                                                   !-but the subsequent call to forces would read from old records -&gt; wrong numbers
                                                                              !-we use file 2 for forces and NACME due to df-casscf
 
 data,truncate,2,5101
 
 if (lastorb.ne.MCSCF)then
    {hf;wf,9,0,1}
 endif
 
 multi;
 occ,6;
 closed,2;
 WF,9,0,1;
 state,3;
 maxiter,40;
 ORBITAL,2140.2;
 NOEXTRA;
 
 cpmcscf,grad,0.1,ACCU=1d-9,save=5101.2;
 forces;samc,5101.2;
 
 if (status.lt.0) then
    text, MCSCF failed to converge.
    text, Attempting uncoupled iterations.
    text, Enlarging PSPACE.
    {multi;
    occ,6;
    closed,2;
    WF,9,0,1;
                                                    ! Info about pspace: https://www.molpro.net/info/2015.1/doc/manual/node244.html
                                                                                 ! uncomment in case of convergence difficulties...
    pspace, 2;
    state,3;
    maxiter,40;
    {iterations
    do,uncouple,1,to,5}
    }
 endif

 Variables initialized (889), CPU time= 0.01 sec
 Commands  initialized (702), CPU time= 0.01 sec, 572 directives.
 Default parameters read. Elapsed time= 0.07 sec

 Checking input...
 Passed
1


                                         ***  PROGRAM SYSTEM MOLPRO  ***
                                       Copyright, TTI GmbH Stuttgart, 2015
                                    Version 2015.1 linked Dec 21 2017 14:32:04


 **********************************************************************************************************************************
 LABEL *                                                                                 
  64 bit serial version                                                                  DATE: 11-Apr-19          TIME: 15:40:27  
 **********************************************************************************************************************************

 SHA1:             ff24c56d2a0a94969fcbec04a36b96e977f08fcb
 **********************************************************************************************************************************

 Variable memory set to 1000000000 words,  buffer space   230000 words



 Permanent file  2  input.wfu        assigned.  Implementation=df    Size=  6.93 MB
 

 PROGRAM * RESTART 


 Reading variables from file 2

 _NUMVAR         =    896.00000000
 _DKROLL_DONE    =      0.00000000
 _FOCKDONE       =      1.00000000
 _GRADONE        =      1.00000000
 _INTDONE        =      1.00000000
 _DIRECT         =      0.00000000
 _DKHO           =     -1.00000000
 _BASIS          =    6-31G
 _ZUNIT          =    ANG
 _NELEC          =      9.00000000
 _PROGRAM        =    FORCES
 _CPUSTEP        =      0.02000000
 _SYSSTEP        =      0.00000000
 _WALLSTEP       =      0.02000000
 _BASINP         =    610.00000000
 _CPUTOT         =      0.69000000
 _DFTEXFAC       =      1.00000000
 _DMX(1:3)       =      0.94365469     0.75392627     1.15347959
 _DMY(1:3)       =      0.00000000    -0.00000000    -0.00000000
 _DMZ(1:3)       =      0.70611554     0.56931893     0.91016068
 _DMX_SCF        =      0.95066584
 _DMY_SCF        =     -0.00000000
 _DMZ_SCF        =      0.74274148
 _EHOMO          =     -1.12680293
 _ELUMO          =     -0.13986690
 _EIGS(1:13)     =    -21.12062114    -1.84839858    -1.20162501    -1.06228365    -1.12680293    -0.13986690
                       -0.04678565     0.64548114     0.65281685     0.72604476     0.78812453     0.92290387
                        1.22726361
 _ENERGY(1:3)    =    -75.59686238   -75.52322741   -75.34009505
 _ENERGY_METHOD  =    MULTI
 _ENERGY_BASIS   =    6-31G
 _GEOMETRY_METHOD=     
 _GEOMETRY_BASIS =     
 _ENUC           =      9.01019364
 _EPS1(1:6)      =    -21.09657526    -1.82282673    -0.99669974    -0.89499944    -1.05496715     0.34670268
 _GRADENERG      =    -75.59686238
 _GRADEXFAC      =   9999.00000000
 _GRADMETHOD     =      5.00000000
 _VIRIAL         =     -0.08582747
 _ITERATIONS     =      4.00000000
 _LASTNELEC      =      5.00000000
 _LASTSPIN       =      1.00000000
 _LASTSYM        =      1.00000000
 _ORBITAL        =   2140.20000000
 _SEIG_MIN       =      0.07068864
 _SEWPROP        =      1.00000000
 _STATUS         =      1.00000000
 _SYSTOT         =      0.50000000
 _WALLTOT        =      2.17000000
 _LASTORB        =    MCSCF
 _PGROUP         =    C1  
 _TIME           =    15:27:57
 _DMX_CC(1:3)    =     -0.26805229    -0.26805229    -0.26805229
 _DMY_CC(1:3)    =      0.00000000     0.00000000     0.00000000
 _DMZ_CC(1:3)    =     -0.04348490    -0.04348490    -0.04348490
 _DMX_NUC(1:3)   =      0.77507311     0.77507311     0.77507311
 _DMY_NUC(1:3)   =      0.00000000     0.00000000     0.00000000
 _DMZ_NUC(1:3)   =      0.61223480     0.61223480     0.61223480
 _TRDMX(1:3)     =      0.00000000     0.00000000    -0.04829396
 _TRDMY(1:3)     =     -0.18794631     0.01582209     0.00000000
 _TRDMZ(1:3)     =      0.00000000     0.00000000     0.09072744

 Geometry written to block  1 of record 700


 **********************************************************************************************************************************
 DATASETS  * FILE   NREC   LENGTH (MB)   RECORD NAMES
              2       8        7.26       500      700      610     1000      520     2100     2140     5101   
                                          VAR     GEOM    BASINP    BASIS   MCVARS     RHF     MCSCF   CPSAMC    

 PROGRAMS   *        TOTAL   RESTART
 CPU TIMES  *         0.19      0.01
 REAL TIME  *         0.20 SEC
 DISK USED  *         0.03 MB      
 **********************************************************************************************************************************

 PUNCHFILE INPUT.PUN OPENED

 ZSYMEL=NOSYM
 ZUNIT=ANG
 

Geometry recognized as XYZ

 SETTING BASIS          =    6-31G

 

 TRUNCATING FILE 1 AFTER   1 RECORDS

 TRUNCATING FILE 2 BEFORE RECORD  5101


 **********************************************************************************************************************************
 DATASETS  * FILE   NREC   LENGTH (MB)   RECORD NAMES
              2       7        7.26       500      700      610     1000      520     2100     2140   
                                          VAR     GEOM    BASINP    BASIS   MCVARS     RHF     MCSCF   

 PROGRAMS   *        TOTAL      DATA   RESTART
 CPU TIMES  *         0.20      0.00      0.01
 REAL TIME  *         0.21 SEC
 DISK USED  *         9.21 MB      
 **********************************************************************************************************************************


 Recomputing integrals since basis changed


 Using spherical harmonics

 Library entry O      S 6-31G                selected for orbital group  1
 Library entry O      P 6-31G                selected for orbital group  1
 Library entry H      S 6-31G                selected for orbital group  2


 PROGRAM * SEWARD (Integral evaluation for generally contracted gaussian basis sets)     Author: Roland Lindh, 1990

 Geometry written to block  1 of record 700


 Point group  C1  



 ATOMIC COORDINATES

 NR  ATOM    CHARGE       X              Y              Z

   1  O       8.00   -0.098412868    0.000000000   -0.077920079
   2  H       1.00   -0.122110289    0.000000000    1.782581267
   3  H       1.00    1.684214663    0.000000000   -0.545758290

 Bond lengths in Bohr (Angstrom)

 1-2  1.860652259  1-3  1.842995796
     ( 0.984614773)     ( 0.975271375)

 Bond angles

  2-1-3  105.43499485

 NUCLEAR CHARGE:                   10
 NUMBER OF PRIMITIVE AOS:          30
 NUMBER OF SYMMETRY AOS:           30
 NUMBER OF CONTRACTIONS:           13   (  13A   )
 NUMBER OF CORE ORBITALS:           1   (   1A   )
 NUMBER OF VALENCE ORBITALS:        6   (   6A   )


 NUCLEAR REPULSION ENERGY    8.97967062

 EXTRA SYMMETRY OF AOS IN SYMMETRY 1:   1 1 1 1 2 1 1 2 1 1   1 1 1

 Eigenvalues of metric

         1 0.712E-01 0.125E+00 0.327E+00 0.328E+00 0.424E+00 0.498E+00 0.690E+00 0.755E+00


 Contracted 2-electron integrals neglected if value below      1.0D-11
 AO integral compression algorithm  1   Integral accuracy      1.0D-11

     0.262 MB (compressed) written to integral file ( 95.6%)


 NUMBER OF SORTED TWO-ELECTRON INTEGRALS:       4186.     BUFFER LENGTH:  32768
 NUMBER OF SEGMENTS:   1  SEGMENT LENGTH:       4186      RECORD LENGTH: 524288

 Memory used in sort:       0.56 MW

 SORT1 READ        6781. AND WROTE        2280. INTEGRALS IN      1 RECORDS. CPU TIME:     0.00 SEC, REAL TIME:     0.00 SEC
 SORT2 READ        2280. AND WROTE        4186. INTEGRALS IN      1 RECORDS. CPU TIME:     0.01 SEC, REAL TIME:     0.01 SEC

 FILE SIZES:   FILE 1:    20.2 MBYTE,  FILE 4:     4.2 MBYTE,   TOTAL:     24.4 MBYTE

 OPERATOR DM      FOR CENTER  0  COORDINATES:    0.000000    0.000000    0.000000


 **********************************************************************************************************************************
 DATASETS  * FILE   NREC   LENGTH (MB)   RECORD NAMES
              1      19       19.92       500      700      610      900      950      970     1000      129      960     1100   
                                          VAR     GEOM    BASINP   SYMINP    ZMAT    AOBASIS   BASIS     P2S    ABASIS      S 
                                         1400     1410     1200     1210     1080     1600     1650     1300     1700   
                                           T        V       H0       H01     AOSYM     SMH    MOLCAS    ERIS     OPER   

              2       7        7.26       500      700      610     1000      520     2100     2140   
                                          VAR     GEOM    BASINP    BASIS   MCVARS     RHF     MCSCF   

 PROGRAMS   *        TOTAL       INT      DATA   RESTART
 CPU TIMES  *         0.51      0.31      0.00      0.01
 REAL TIME  *         1.09 SEC
 DISK USED  *        31.68 MB      
 **********************************************************************************************************************************


 PROGRAM * MULTI (Direct Multiconfiguration SCF)       Authors: P.J. Knowles, H.-J. Werner (1984)     S.T. Elbert (1988)


 Number of closed-shell orbitals:   2 (   2 )
 Number of active  orbitals:        4 (   4 )
 Number of external orbitals:       7 (   7 )

 State symmetry 1

 Number of electrons:     5    Spin symmetry=Doublet   Space symmetry=1
 Number of states:        3
 Number of CSFs:         20   (24 determinants, 24 intermediate states)

 Iteration controls:
             1  2  3  4  5  6  7  8  9 10 11 12 13 14 15 16 17 18 19 20 21 22 23 24 25 26 27 28 29 30 31 32 33 34 35 36 37 38 39
 DIAGCI      T  T  T  T  T  T  T  T  T  T  T  T  T  T  T  T  T  T  T  T  T  T  T  T  T  T  T  T  T  T  T  T  T  T  T  T  T  T  T
 WERNER      T  T  T  T  T  T  T  T  T  T  T  T  T  T  T  T  T  T  T  T  T  T  T  T  T  T  T  T  T  T  T  T  T  T  T  T  T  T  T
 INTERNAL    F  T  T  T  T  T  T  T  T  T  T  T  T  T  T  T  T  T  T  T  T  T  T  T  T  T  T  T  T  T  T  T  T  T  T  T  T  T  T

 Molecular orbitals read from record     2140.2  Type=MCSCF/NATURAL (state averaged)

 Wavefunction dump at record             2140.2

 Convergence thresholds  0.10E-05 (gradient)  0.10E-07 (energy)  0.10E-02 (step length)

 Weight factors for state symmetry  1:    0.33333   0.33333   0.33333

 Number of orbital rotations:       50   (     8 Core/Active     14 Core/Virtual   0 Active/Active     28 Active/Virtual)
 Total number of variables:        122


 ITER. MIC  NCI  NEG     ENERGY(VAR)     ENERGY(PROJ)   ENERGY CHANGE     GRAD(0)  GRAD(ORB)   GRAD(CI)     STEP       TIME

   1   24    7    0     -75.48749614     -75.48750431   -0.00000817    0.00503816 0.00000002 0.00000000  0.50D-02      0.01
   2   20   13    0     -75.48750431     -75.48750431   -0.00000000    0.00000150 0.00000007 0.00000000  0.97D-04      0.02
   3   20   13    0     -75.48750431     -75.48750431   -0.00000000    0.00000006 0.00000000 0.00000000  0.43D-05      0.04
   4   21   10    0     -75.48750431     -75.48750431   -0.00000000    0.00000000 0.00000000 0.00000000  0.16D-06      0.05

 ** WVFN ****  CONVERGENCE REACHED, FINAL GRADIENT:  0.59D-09

 Solving MCSCF z-vector equations for state  0.1, requested accuracy=      0.10D-08
 Convergence reached in  18 iterations ( 18 expansion vectors), accuracy=  0.81D-09

 SA-Gradient information saved on record      5101.2



 Results for state 1.1
 =====================

 !MCSCF STATE 1.1 Energy              -75.597299373024
 Nuclear energy                         8.97967062
 Kinetic energy                        75.51243540
 One electron energy                 -117.45870574
 Two electron energy                   32.88173576
 Virial ratio                           2.00112384

 !MCSCF STATE 1.1 Dipole moment         0.94389045     0.00000000     0.70730832
 Dipole moment /Debye                   2.39897309     0.00000000     1.79768067

 Results for state 2.1
 =====================

 !MCSCF STATE 2.1 Energy              -75.524024074978
 Nuclear energy                         8.97967062
 Kinetic energy                        75.60282521
 One electron energy                 -117.62305143
 Two electron energy                   33.11935674
 Virial ratio                           1.99895770

 !MCSCF STATE 2.1 Dipole moment         0.75607501     0.00000000     0.57190930
 Dipole moment /Debye                   1.92162512     0.00000000     1.45355324

 Results for state 3.1
 =====================

 !MCSCF STATE 3.1 Energy              -75.341189495028
 Nuclear energy                         8.97967062
 Kinetic energy                        75.87621020
 One electron energy                 -117.68141675
 Two electron energy                   33.36055664
 Virial ratio                           1.99294877

 !MCSCF STATE 3.1 Dipole moment         1.15232513     0.00000000     0.91210362
 Dipole moment /Debye                   2.92872651     0.00000000     2.31818432

 State-averaged charge density matrix saved on record  2140.2 (density set 1)

 !MCSCF expec         <1.1|DMX|1.1>     0.943890449148 au =     2.398973087745 Debye
 !MCSCF expec         <2.1|DMX|2.1>     0.756075007271 au =     1.921625116979 Debye
 !MCSCF trans         <3.1|DMX|2.1>    -0.048706852347 au =    -0.123792361787 Debye
 !MCSCF expec         <3.1|DMX|3.1>     1.152325133786 au =     2.928726513528 Debye

 !MCSCF trans         <2.1|DMY|1.1>    -0.186474465325 au =    -0.473939771581 Debye
 !MCSCF trans         <3.1|DMY|1.1>     0.016832130953 au =     0.042780207387 Debye

 !MCSCF expec         <1.1|DMZ|1.1>     0.707308316125 au =     1.797680670096 Debye
 !MCSCF expec         <2.1|DMZ|2.1>     0.571909299478 au =     1.453553237367 Debye
 !MCSCF trans         <3.1|DMZ|2.1>     0.093241738346 au =     0.236981337346 Debye
 !MCSCF expec         <3.1|DMZ|3.1>     0.912103620100 au =     2.318184318774 Debye


 NATURAL ORBITALS (state averaged)
 =================================

   Orb     Occ        Energy       Coefficients

                                   1 1s      1 1s      1 1s      1 2px     1 2py     1 2pz     1 2px     1 2py     1 2pz     2 1s   
                                   2 1s      3 1s      3 1s   

   1.1  2.00000   -21.096089     0.995803  0.021932 -0.007978  0.001250 -0.000000  0.001046 -0.001422 -0.000000 -0.001092  0.000144
                                 0.001846  0.000124  0.001885

   2.1  2.00000    -1.820295    -0.216137  0.501816  0.480857  0.118592  0.000000  0.064355  0.069259  0.000000  0.040323  0.118280
                                -0.031150  0.143227 -0.027654

   3.1  1.66612    -0.995591     0.069767 -0.188192 -0.199584  0.597741 -0.000000  0.083448  0.341398 -0.000000  0.071936 -0.020062
                                 0.013762  0.238559  0.046580

   4.1  1.66572    -0.894065     0.000000  0.000000 -0.000000  0.000000  0.701339 -0.000000  0.000000  0.443149 -0.000000  0.000000
                                 0.000000 -0.000000 -0.000000

   5.1  1.65549    -1.052601     0.033198 -0.093355 -0.104755 -0.041916  0.000000  0.581683  0.004987  0.000000  0.308566  0.295032
                                 0.059175 -0.137783 -0.015564

   6.1  0.01266     0.341473     0.028561 -0.028477 -0.269718  0.154012 -0.000000 -0.819787  0.071519  0.000000  0.121416  0.714121
                                 0.230802 -0.196613 -0.097961

 Total charge:   1.000000000000
 

 Natural orbital dump (state averaged) at molpro section  2140.2    (Orbital set 2)


 CI vector
 =========

 2a20      0.9954992  -0.0000000  -0.0000000
 22a0      0.0000000   0.4948681   0.8672989
 a220     -0.0000000   0.8648477  -0.4925899
 2a02     -0.0887011   0.0000000   0.0000000
 a202     -0.0000000  -0.0780657   0.0444637

 TOTAL ENERGIES                       -75.59729937   -75.52402407   -75.34118950



 **********************************************************************************************************************************
 DATASETS  * FILE   NREC   LENGTH (MB)   RECORD NAMES
              1      20       19.96       500      700      610      900      950      970     1000      129      960     1100   
                                          VAR     GEOM    BASINP   SYMINP    ZMAT    AOBASIS   BASIS     P2S    ABASIS      S 
                                         1400     1410     1200     1210     1080     1600     1650     1300     1700     1380   
                                           T        V       H0       H01     AOSYM     SMH    MOLCAS    ERIS     OPER     JKOP   

              2       8        7.26       500      700      610     1000      520     2100     2140     5101   
                                          VAR     GEOM    BASINP    BASIS   MCVARS     RHF     MCSCF   CPSAMC    

 PROGRAMS   *        TOTAL     MULTI       INT      DATA   RESTART
 CPU TIMES  *         0.58      0.06      0.31      0.00      0.01
 REAL TIME  *         1.19 SEC
 DISK USED  *        31.68 MB      
 **********************************************************************************************************************************


 PROGRAM * FORCE (Gradient of the energy)

 SA-MCSCF information from    5101.2
 Orbitals from record         2140.2

 Number of closed-shell orbitals:  2 (  2 )
 Number of active orbitals:        4 (  4 )
 Number of occupied orbitals:      6 (  6 )

 Number of electrons=  9     Doublet     Space symmetry=1      Wavefunction type: SA-MCSCF


 End of calculation of the energy gradient  ,IREST=   0


 SA-MC GRADIENT FOR STATE 0.1

 Atom          dE/dx               dE/dy               dE/dz

   1        -0.009649469         0.000000000         0.002806318
   2         0.019236994        -0.000000000        -0.025066632
   3        -0.009587525        -0.000000000         0.022260314

 Nuclear force contribution to virial =        -0.074597581


 **********************************************************************************************************************************
 DATASETS  * FILE   NREC   LENGTH (MB)   RECORD NAMES
              1      20       19.96       500      700      610      900      950      970     1000      129      960     1100   
                                          VAR     GEOM    BASINP   SYMINP    ZMAT    AOBASIS   BASIS     P2S    ABASIS      S 
                                         1400     1410     1200     1210     1080     1600     1650     1300     1700     1380   
                                           T        V       H0       H01     AOSYM     SMH    MOLCAS    ERIS     OPER     JKOP   

              2       8        7.26       500      700      610     1000      520     2100     2140     5101   
                                          VAR     GEOM    BASINP    BASIS   MCVARS     RHF     MCSCF   CPSAMC    

 PROGRAMS   *        TOTAL    FORCES     MULTI       INT      DATA   RESTART
 CPU TIMES  *         0.59      0.02      0.06      0.31      0.00      0.01
 REAL TIME  *         1.21 SEC
 DISK USED  *        31.68 MB      
 **********************************************************************************************************************************

 MULTI/6-31G energy=    -75.341189495028

        MULTI   
    -75.59729937
 **********************************************************************************************************************************
 Molpro calculation terminated
 Variable memory released
